{
 "$schema":"https://json-schema.org/draft/2020-12/schema","$id":"chart_plan.json","title":"chart_plan","type":"object","additionalProperties":false,
 "required":["planning_rationale","special_features","sections","chart_table","total"],
 "properties":{
  "planning_rationale":{"type":"string","minLength":1},"special_features":{"type":"array","items":{"type":"string"}},
  "sections":{"type":"array","items":{"type":"object","additionalProperties":false,"required":["section_id","title","question_ids","claim_ids","required_content","limitation_ids"],"properties":{"section_id":{"enum":["personality","bazi","ziwei","astrology","synthesis","timing","relationships","career","wellbeing","practice"]},"title":{"type":"string","minLength":1},"question_ids":{"type":"array","items":{"type":"string"}},"claim_ids":{"type":"array","items":{"type":"string"}},"required_content":{"type":"array","items":{"type":"string"}},"limitation_ids":{"type":"array","uniqueItems":true,"items":{"type":"string"}}}}},
  "chart_table":{"type":"array","items":{"type":"object","additionalProperties":false,"required":["chart_id","section_id","title","patterns","question","purpose","claim_ids","data_refs","representation","unit","domain","missing_policy","caption","limits"],"properties":{"chart_id":{"type":"string","pattern":"^chart-(personality|bazi|ziwei|astrology|synthesis|timing|relationships|career|wellbeing|practice)-[0-9]{2}$"},"section_id":{"enum":["personality","bazi","ziwei","astrology","synthesis","timing","relationships","career","wellbeing","practice"]},"title":{"type":"string","minLength":1},"patterns":{"type":"array","minItems":1,"items":{"type":"string","pattern":"^P(0[1-9]|1[0-7])$"}},"question":{"type":"string","minLength":1},"purpose":{"type":"string","minLength":1},"claim_ids":{"type":"array","items":{"type":"string"}},"data_refs":{"type":"array","minItems":1,"items":{"type":"string"}},"representation":{"enum":["measured","computed","qualitative"]},"unit":{"type":["string","null"]},"domain":{"type":["array","null"],"items":{"type":"number"}},"missing_policy":{"const":"omit_with_disclosure"},"caption":{"type":"string"},"limits":{"type":"array","items":{"type":"string"}}},"allOf":[{"if":{"properties":{"representation":{"enum":["measured","computed"]}},"required":["representation"]},"then":{"properties":{"unit":{"type":"string","minLength":1},"domain":{"type":"array","minItems":2,"items":{"type":"number"}}}}},{"if":{"properties":{"representation":{"const":"qualitative"}},"required":["representation"]},"then":{"properties":{"unit":{"type":"null"},"domain":{"type":"null"}}}}]}},
  "total":{"type":"object","additionalProperties":false,"required":["planned"],"properties":{"planned":{"type":"integer","minimum":0}}},"scope_mode":{"enum":["full","focused"]}
 }
}
