{"planning_rationale":"Synthetic reading fixture covers one numeric visualization, multiple semantic sections, and appendix references.","special_features":[],"sections":[{"section_id":"personality","title":"记录与尺度","question_ids":["Q-FX-01"],"claim_ids":["FX-C-01"],"required_content":["合成值与表格"],"limitation_ids":[]},{"section_id":"practice","title":"行动与回看","question_ids":["Q-FX-02"],"claim_ids":[],"required_content":["行动说明"],"limitation_ids":[]},{"section_id":"relationships","title":"逐行核对","question_ids":["Q-FX-03"],"claim_ids":[],"required_content":["长表"],"limitation_ids":[]}],"chart_table":[{"chart_id":"chart-personality-01","section_id":"personality","title":"合成数据条形图","patterns":["P01"],"question":"如何展示一条可追溯值？","purpose":"验证SVG和数据表打印。","claim_ids":["FX-C-01"],"data_refs":["chart-data#/scores/item"],"representation":"computed","unit":"分","domain":[0,30],"missing_policy":"omit_with_disclosure","caption":"合成原始值","limits":["合成样本"]}],"total":{"planned":1},"scope_mode":"focused"}